<?xml version="1.0" encoding="UTF-8" ?>
<!DOCTYPE daily_sales SYSTEM "daily_sales.dtd">
<daily_sales day="26" month="6" year="2018" store="WORTEN" local="STA. CATARINA" tin="503630330">

	<clients>

		<client id_c="C1" tin_c="119120364">
			<name>Patricia Brown</name>
			<address locality="I">625 Oak St., Dawnstar IL 61914</address>
			<contacts>
				<contact type="PHONE NUMBER">800-555-5669</contact>
				<contact type="EMAIL">patricia_brown@email.com</contact>
			</contacts>
		</client>

		<client id_c="C2" tin_c="386931498">
			<name>Jennifer Davis</name>
			<address locality="P">890 Main St., Pythonville LA 29947</address>
			<contacts>
				<contact type="PHONE NUMBER">568-555-6051</contact>
				<contact type="EMAIL">jennifer_davis@email.com</contact>
			</contacts>
		</client>

		<client id_c="C3" tin_c="201728958">
			<name>Michael Smith</name>
			<address locality="H">732 High St., Valyria KY 97152</address>
			<contacts>
				<contact type="PHONE NUMBER">516-555-4615</contact>
				<contact type="EMAIL">michael_smith@email.com</contact>
			</contacts>
		</client>

		<client id_c="C4" tin_c="513672385">
			<name>Barbara Williams</name>
			<address locality="W">212 Cedar St., Sunnydale CT 74983</address>
			<contacts>
				<contact type="PHONE NUMBER">998-555-7385</contact>
				<contact type="EMAIL">barbara_williams@email.com</contact>
			</contacts>
		</client>

		<client id_c="C5" tin_c="361113513">
			<name>Eric Williams</name>
			<address locality="A">969 High St., Atlantis VA 34075</address>
			<contacts>
				<contact type="PHONE NUMBER">900-555-3205</contact>
				<contact type="EMAIL">eric_williams@email.com</contact>
			</contacts>
		</client>

	</clients>

	<sales>

		<sale id_s="S1" client="C3" unit="EURO">
			<products>
				<product quantity="8">P1969822</product>
				<product quantity="3">P9042590</product>
				<product quantity="8">P6989884</product>
			</products>
			<order_price>3520.0</order_price>
			<shipping>47.5</shipping>
			<final_price>3567.5</final_price>
			<delivery_address></delivery_address>
			<invoice_address locality="Z">121 Hill St., Braavos UT 92474</invoice_address>
		</sale>

		<sale id_s="S2" client="C2" unit="EURO">
			<products>
				<product quantity="1">P6892632</product>
				<product quantity="8">P9862574</product>
			</products>
			<order_price>4712.0</order_price>
			<shipping>22.5</shipping>
			<final_price>4734.5</final_price>
			<delivery_address locality="W">838 Main St., Balmora MT 56526</delivery_address>
			<invoice_address locality="W">173 Main St., Springfield RI 55924</invoice_address>
		</sale>

		<sale id_s="S3" client="C4" unit="EURO">
			<products>
				<product quantity="6">P6867320</product>
				<product quantity="3">P7856282</product>
			</products>
			<order_price>480.0</order_price>
			<shipping>22.5</shipping>
			<final_price>502.5</final_price>
			<delivery_address></delivery_address>
			<invoice_address locality="L">607 Washington St., Blackwater NH 97183</invoice_address>
		</sale>

		<sale id_s="S4" client="C5" unit="EURO">
			<products>
				<product quantity="3">P8034556</product>
			</products>
			<order_price>1920.0</order_price>
			<shipping>7.5</shipping>
			<final_price>1927.5</final_price>
			<delivery_address></delivery_address>
			<invoice_address></invoice_address>
		</sale>

		<sale id_s="S5" client="C5" unit="EURO">
			<products>
				<product quantity="7">P4562858</product>
				<product quantity="9">P3614060</product>
				<product quantity="2">P5429083</product>
			</products>
			<order_price>842.0</order_price>
			<shipping>45.0</shipping>
			<final_price>887.0</final_price>
			<delivery_address></delivery_address>
			<invoice_address></invoice_address>
		</sale>

	</sales>

</daily_sales>